<?xml version="1.0"?>
<xs:schema xmlns:xs="http://www.w3.org/2001/XMLSchema">

    <xs:import namespace="http://example/annotation" schemaLocation="annotation.xsd"/>

    <xs:element name="document">
        <xs:complexType>
            <xs:sequence>
                <xs:element name="title" type="xs:string"/>
                <xs:element ref="section" minOccurs="0" maxOccurs="unbounded"/>
            </xs:sequence>
        </xs:complexType>
    </xs:element>

    <xs:element name="section">
        <xs:complexType>
            <xs:openContent mode="interleave">
                <xs:any namespace="http://example/annotation" processContents="lax"/>
            </xs:openContent>
            <xs:sequence>
                <xs:element name="title" type="xs:string"/>
                <xs:element name="para" minOccurs="0" maxOccurs="unbounded">
                    <xs:complexType mixed="true">
                        <xs:sequence>
                            <xs:element name="link" minOccurs="0" maxOccurs="unbounded">
                                <xs:complexType>
                                    <xs:attribute name="url" type="xs:anyURI" use="required"/>
                                </xs:complexType>
                            </xs:element>
                        </xs:sequence>
                    </xs:complexType>
                </xs:element>
            </xs:sequence>
        </xs:complexType>
    </xs:element>

</xs:schema>